{
  "$schema": "https://json-schema.org/draft/2020-12/schema",
  "type": "object",
  "required": ["description", "alibis", "hypotheses", "culprit"],
  "additionalProperties": false,
  "properties": {
    "description": { "type": "string", "minLength": 1 },
    "sourceOverrides": { "type": "object", "additionalProperties": { "type": "string", "minLength": 1 } },
    "alibis": {
      "type": "array",
      "minItems": 1,
      "items": {
        "type": "object",
        "required": ["characterId", "label", "cardIds", "minimumRequired", "note"],
        "additionalProperties": false,
        "properties": {
          "characterId": { "type": "string" },
          "label": { "type": "string" },
          "cardIds": { "type": "array", "minItems": 2, "uniqueItems": true, "items": { "type": "string" } },
          "requiredCardIds": { "type": "array", "uniqueItems": true, "items": { "type": "string" } },
          "minimumRequired": { "type": "integer", "minimum": 2 },
          "conditional": { "type": "boolean" },
          "note": { "type": "string" }
        }
      }
    },
    "hypotheses": {
      "type": "array",
      "minItems": 1,
      "items": {
        "type": "object",
        "required": ["characterId", "label", "confirmedAct", "insufficientFinding", "plusAlpha", "apparentSmokingGunIds", "plusAlphaSupportIds", "verificationIds", "actual"],
        "additionalProperties": false,
        "properties": {
          "characterId": { "type": "string", "minLength": 1 },
          "label": { "type": "string", "minLength": 1 },
          "confirmedAct": { "type": "string", "minLength": 1 },
          "insufficientFinding": { "type": "string", "minLength": 1 },
          "plusAlpha": { "type": "string", "minLength": 1 },
          "apparentSmokingGunIds": { "type": "array", "minItems": 1, "uniqueItems": true, "items": { "type": "string", "minLength": 1 } },
          "plusAlphaSupportIds": { "type": "array", "minItems": 1, "uniqueItems": true, "items": { "type": "string", "minLength": 1 } },
          "verificationIds": { "type": "array", "minItems": 1, "uniqueItems": true, "items": { "type": "string", "minLength": 1 } },
          "actual": { "type": "string", "minLength": 1 }
        }
      }
    },
    "culprit": {
      "type": "object",
      "required": ["characterId", "conclusion", "axes"],
      "additionalProperties": false,
      "properties": {
        "characterId": { "type": "string" },
        "conclusion": { "type": "string" },
        "axes": {
          "type": "array",
          "minItems": 5,
          "items": {
            "type": "object",
            "required": ["id", "label", "cardIds", "paths"],
            "additionalProperties": false,
            "properties": {
              "id": { "type": "string" },
              "label": { "type": "string" },
              "cardIds": { "type": "array", "minItems": 2, "uniqueItems": true, "items": { "type": "string" } },
              "paths": {
                "type": "array",
                "minItems": 2,
                "items": { "type": "array", "minItems": 2, "uniqueItems": true, "items": { "type": "string" } }
              }
            }
          }
        }
      }
    }
  }
}
